{
  "namespace": "io.github.aetiusgular",
  "name": "web-search",
  "title": "Web search",
  "description": "Search the web with the Exa connector. Use when a task needs a current fact, a page the model has not seen, or sources to cite.",
  "version": "0.1.0",
  "status": "active",
  "license": "MIT",
  "allowedTools": [
    "exa/web_search_exa",
    "exa/web_fetch_exa"
  ],
  "repository": {
    "url": "https://github.com/aetiusgular/tk",
    "type": "git"
  },
  "packages": [
    {
      "registryType": "git",
      "url": "https://github.com/aetiusgular/tk",
      "ref": "main",
      "subfolder": "library/catalog/tk-connectors/skills/web-search"
    }
  ],
  "_meta": {
    "io.modelcontextprotocol.registry/publisher-provided": {
      "io.github.aetiusgular.tk": {
        "kind": "skill",
        "tier": "own",
        "status": "active",
        "runner": {
          "kind": "host",
          "note": "runs as you"
        },
        "exposure": {
          "default": "direct"
        },
        "trust": {
          "namespaceProof": "none",
          "provenance": {
            "kind": "none"
          },
          "contentSha256": "0000000000000000000000000000000000000000000000000000000000000000",
          "scans": [],
          "liveness": {
            "state": "not-applicable"
          }
        }
      }
    }
  }
}
