{
  "namespace": "io.github.aetiusgular",
  "name": "deployments",
  "title": "Deployments",
  "description": "Inspect Vercel projects, deployments, runtime logs and errors, and search Vercel's documentation. Use when a deploy failed, a production error needs a cause, or a Vercel setting is in question.",
  "version": "0.1.0",
  "status": "active",
  "license": "MIT",
  "allowedTools": [
    "vercel/list_projects",
    "vercel/list_deployments",
    "vercel/get_deployment",
    "vercel/get_runtime_logs",
    "vercel/get_runtime_errors",
    "vercel/search_vercel_documentation"
  ],
  "repository": {
    "url": "https://github.com/aetiusgular/tk",
    "type": "git"
  },
  "packages": [
    {
      "registryType": "git",
      "url": "https://github.com/aetiusgular/tk",
      "ref": "main",
      "subfolder": "library/catalog/tk-connectors/skills/deployments"
    }
  ],
  "_meta": {
    "io.modelcontextprotocol.registry/publisher-provided": {
      "io.github.aetiusgular.tk": {
        "kind": "skill",
        "tier": "own",
        "status": "active",
        "runner": {
          "kind": "host",
          "note": "runs as you"
        },
        "exposure": {
          "default": "direct"
        },
        "trust": {
          "namespaceProof": "none",
          "provenance": {
            "kind": "none"
          },
          "contentSha256": "0000000000000000000000000000000000000000000000000000000000000000",
          "scans": [],
          "liveness": {
            "state": "not-applicable"
          }
        }
      }
    }
  }
}
